{
  "specversion": "1.0",
  "id": "evt_rollbackexample",
  "type": "windforce.release.rolled_back",
  "source": "/workspaces/default/control-plane",
  "subject": "apps/checkout/releases/rel_stable",
  "time": "2026-07-18T04:00:00Z",
  "datacontenttype": "application/json",
  "data": {
    "workspace": "default",
    "app_key": "checkout",
    "release_id": "rel_stable",
    "commit": "commit-stable",
    "previous_release_id": "rel_current",
    "previous_commit": "commit-current",
    "actor": "operator@example.test",
    "reason": "Restore the stable release"
  }
}
